URL;ID;Name;Brand;Article;Gender;Image;Ext Images;Description;Sizes;Color;Category
https://www.tsum.ru/product/10533886;10533886;Шерстяной костюм;Kiton;5376135;male;https://st-cdn.tsum.com/sig/35cd5c450132c8a80dd41c680f26a4b2/width/763/i/d0/18/8d/05/d0188d05-aecb-3d33-8998-761540df3b52.jpg;https://st-cdn.tsum.com/sig/23009a9b43407e8026891ee4a9e8e1c6/width/763/i/f7/f9/3b/08/f7f93b08-3125-3dbe-8549-796d602e1ae4.jpg,https://st-cdn.tsum.com/sig/0dd8fef233a1078435e26ecd92b31cc5/width/763/i/f7/a5/26/7e/f7a5267e-83f6-3f5c-b288-392da9176ae6.jpg;Для создания темно-синего костюма из осенне-зимней коллекции использовали прочный материал Natural Stretch, сотканный из тонких нитей шерсти. За счет их особой обработки ткань получается мягкой и эластичной, поэтому изделие точно садится по фигуре, обеспечивая свободу движения.;48,48,50,50,52,52,52,52,54,54,54,54,56,56,56,58,58,60,62,64;Темно-синий;Костюмы
https://www.tsum.ru/product/10608810;10608810;Костюм из кашемира и шелка;KNT;5452865;male;https://st-cdn.tsum.com/sig/2312e4abf10e9492b482d70328e5d2dc/width/763/i/f6/25/9e/5f/f6259e5f-251e-3fda-88bb-cef0eef4e9f4.jpg;https://st-cdn.tsum.com/sig/1c3501b5e0f470ef6ae8bb4f5cb39eeb/width/763/i/a4/19/eb/ff/a419ebff-8b84-324d-a11c-54f59b3cb834.jpg,https://st-cdn.tsum.com/sig/9178b6295f61eab35316ed6ea306dc67/width/763/i/ca/16/ea/03/ca16ea03-1edc-3754-a112-dabe25263469.jpg;Темно-серый костюм из осенне-зимней коллекции станет идеальной основой образа в стиле free friday c водолазкой и кроссовками. Для создания комплекта из однобортного пиджака и брюк со стрелками и отворотами использовали материал, изготовленный вручную на специальных ткацких станках. Кашемир в его составе отвечает за мягкость и тепло, а шелк обеспечивает прочность изделия.;46,48,50,52,54,56,58,60,62;Темно-серый;Костюмы
https://www.tsum.ru/product/10627824;10627824;Шерстяной смокинг-тройка;Brioni;5452301;male;https://st-cdn.tsum.com/sig/189948f6ae204d6880ad2479404ca684/width/763/i/a7/51/a8/54/a751a854-6709-36ec-bdb2-1707072dea0f.jpg;https://st-cdn.tsum.com/sig/482becbca9f82b638a85aaa08c9f1184/width/763/i/57/db/11/c2/57db11c2-c6c8-3cc5-a8e3-d1875f52b276.jpg,https://st-cdn.tsum.com/sig/d4790433029d0a021e16d7c2f9af28d2/width/763/i/7e/df/bc/b7/7edfbcb7-80f7-3d7c-9c31-517785ee5707.jpg;Черный фрак из осенне-зимней коллекции станет беспроигрышным решением для дресс-кода white tie. Для пошива костюма мастера бренда использовали тонкую мягкую шерсть, которая хорошо держит форму. Из такого же материала выполнили застегивающийся тремя пуговицами белоснежный жилет с шалевыми лацканами.;50,52,54,56,58;Черный;Смокинги
https://www.tsum.ru/product/10656066;10656066;Шерстяной костюм;Tom Ford;5282459;male;https://st-cdn.tsum.com/sig/024a62b60a340a035196d40fbdaedbb1/width/763/i/6a/08/42/cc/6a0842cc-d910-31ec-ad6f-26c707b4f092.jpg;https://st-cdn.tsum.com/sig/452eace234575277408440eacd0fe4d4/width/763/i/6e/e5/e9/a7/6ee5e9a7-6b4c-3bd0-99ec-7754a0a50803.jpg,https://st-cdn.tsum.com/sig/b49f0c82fa318293cfd8e89b8c663c8c/width/763/i/59/4e/45/66/594e4566-79ec-38fc-8024-96017b321d8c.jpg;Темно-серый костюм из тонкой гладкой шерсти  универсальный вариант, поскольку подойдет как для официальных встреч, так и для неформальных мероприятий. Приталенный однобортный пиджак с четырьмя карманами дополнен прямыми брюками со стрелками и ремешками на поясе.;46,48,48,50,50,52,52,54,56,58,60,62;Темно-серый;Костюмы
https://www.tsum.ru/product/10698028;10698028;Шерстяной костюм;Brioni;5461037;male;https://st-cdn.tsum.com/sig/584f81aac8678c529a3f59ee2ea51f60/width/763/i/91/95/44/57/91954457-62a0-309d-95c1-76b9957a8d0a.jpg;https://st-cdn.tsum.com/sig/33cec7245eb8f3f18d4d001202612577/width/763/i/b8/77/c4/4e/b877c44e-769c-30b9-b5ec-ba75416808dc.jpg,https://st-cdn.tsum.com/sig/a06681d7561f5f9a4c6b51823fcb5d71/width/763/i/c0/1d/3d/8f/c01d3d8f-6ab8-3202-b93d-c6306d203c84.jpg;В весенне-летнюю коллекцию вошли однобортный пиджак и прямые брюки со стрелками. Для изготовления костюма использовали тонкую шерсть Ventiquattro. Вещи из такого материала получаются особенно легкими, эластичными и практически не мнутся из-за особого кручения нитей. Такой комплект идеален для путешествий и командировок, так как не потеряет внешний вид в багаже.;48,50,50,52,54,54,56,56,58,60,64;Синий;Костюмы
https://www.tsum.ru/product/10072894;10072894;Хлопковая сорочка;Tom Ford;5291779;male;https://st-cdn.tsum.com/sig/c772535e5cd25bb1a21b6f6d8412f7c0/width/763/i/b9/f8/7c/25/b9f87c25-e397-367f-a02e-b5b170cd05fc.jpg;https://st-cdn.tsum.com/sig/b38240a1f53596982844abdc855de636/width/763/i/41/f5/e1/6e/41f5e16e-c336-3f78-84a5-7f9b1de2d7f1.jpg,https://st-cdn.tsum.com/sig/b049684e2f4f48a741a8155d7911c65f/width/763/i/6a/75/c3/ef/6a75c3ef-5aa7-3d2c-9975-3b717e73f40b.jpg;Благодаря универсальному голубому оттенку и полному отсутствию декора сорочка впишется в офисный дресс-код. Для создания модели Том Форд выбрал тонкий хлопок. У этого материала много достоинств, но главное  он не деформируется и не выцветает после частых стирок.;39,40,41,42,43,44,45;Голубой;Рубашки
https://www.tsum.ru/product/10245682;10245682;Кашемировый пиджак;Brioni;5418189;male;https://st-cdn.tsum.com/sig/a5ca0d69238e86a5c93c1cf5c8968e38/width/763/i/74/14/d2/15/7414d215-f27c-30aa-8901-1403bc84d598.jpg;https://st-cdn.tsum.com/sig/161f99086204371be3961093e23e51d2/width/763/i/b6/88/4c/21/b6884c21-6e70-3dfd-a520-fe0874d9bdb5.jpg,https://st-cdn.tsum.com/sig/672e29f3298eb39e454d746a8adb404f/width/763/i/ae/a1/12/a5/aea112a5-6749-307c-8be2-210c0b5a0616.jpg;В коллекцию сезона осень-зима вошел серый пиджак в крупную клетку. Мастера марки вручную выполнили модель из мягкого плотного кашемира, совершив для этого порядка 200 операций (детали были многократно отутюжены, поэтому вещь садится точно по фигуре). Наши стилисты предлагают сочетать изделие с брюками в тон, белой рубашкой и черным жилетом. Образ завершат неяркий галстук и лоферы.;50,52,52,54,56,58,60,62,64,66;Серый;Пиджаки
https://www.tsum.ru/product/10267907;10267907;Хлопковая сорочка;Loro Piana;5419419;male;https://st-cdn.tsum.com/sig/4827ee35b1682ff2a057570ec4d205bb/width/763/i/76/d9/bf/d7/76d9bfd7-3f58-3754-b8f3-de1fe330238b.jpg;https://st-cdn.tsum.com/sig/4050d6d25e05961871d0f9b047062e8d/width/763/i/87/66/40/58/87664058-4892-38e3-a183-1cb660a07c43.jpg,https://st-cdn.tsum.com/sig/5b5158d233979fb63c7629cc372e6ac5/width/763/i/49/1f/09/f4/491f09f4-6e06-33c0-b635-14e43efa28ad.jpg;В коллекцию сезона осень-зима вошла слегка приталенная сорочка в мелкую синюю клетку. Для создания модели с длинными рукавами и воротником акула использовали тонкий легкий хлопок поплин. Этот дышащий материал с особым переплетением волокон почти не мнется и хорошо держит форму, поэтому вещь будет выглядеть опрятно в течение всего дня.;40,41,42,43,44,45,46;Синий;Рубашки
https://www.tsum.ru/product/10285410;10285410;Шерстяное поло;Zegna;5420959;male;https://st-cdn.tsum.com/sig/c09c499cb2687884c5938bd3d2a42f3c/width/763/i/7d/ac/b9/9e/7dacb99e-ecdb-3325-a640-88e4abf1c3d8.jpg;https://st-cdn.tsum.com/sig/1b79faf614b5f4cd44b570edc6c1fab0/width/763/i/c6/3d/73/f5/c63d73f5-dc28-3a25-9f71-48545323d50f.jpg,https://st-cdn.tsum.com/sig/9e1c02c477725d92030124516ee76f63/width/763/i/9b/78/16/39/9b781639-4751-3334-9419-b46f5a58f9a8.jpg;В коллекцию сезона осень-зима вошло темно-синее поло с длинными рукавами. Отложной воротник отделан шоколадным кантом. Для создания модели мастера марки вместо привычного хлопка пике использовали мягкий трикотаж на основе теплой шерсти и прочного шелка. Наши стилисты предлагают дополнить образ джинсами и кедами.;46,48,50,52,54,56,58,60;Темно-синий;Поло
